{
  "schemaVersion": 1,
  "generatedAt": "2026-10-13T00:00:00.000Z",
  "updatePolicy": "reviewed-pull-request",
  "upstreams": [
    {
      "id": "firstmate",
      "repository": "https://github.com/kunchenguid/firstmate.git",
      "commit": "7df545bf74ff729ed1733f77b0aea02a9b164ac1",
      "version": null,
      "install": { "lane": "distro-clone" }
    },
    {
      "id": "treehouse",
      "repository": "https://github.com/kunchenguid/treehouse.git",
      "commit": "20464a779bc30932d1dd4875886d916f4d4c28b3",
      "version": "3.1.3",
      "install": {
        "lane": "github-release",
        "tag": "v3.1.3",
        "binary": "treehouse",
        "artifacts": {
          "darwin-x64": { "name": "treehouse-v3.1.3-darwin-amd64.tar.gz", "sha256": "e7709d24401178f2223c5fed2f37e157c5024010be3652c2bfa6dfc758bb021a", "executableSha256": "2165bff52285b7523099f6398051dca3251ed4b38d002de98e576830b2fd7795" },
          "darwin-arm64": { "name": "treehouse-v3.1.3-darwin-arm64.tar.gz", "sha256": "1c05cf2ac3f28c65550e5bbf62c7545380e3a1f81ab1b844888fd481e7dcdca2", "executableSha256": "aec56f662fc6a606432dd5aeb32c0e218156d2faf5a473d25db83efc68092de5" },
          "linux-x64": { "name": "treehouse-v3.1.3-linux-amd64.tar.gz", "sha256": "78c820c5872bf9d9d3eb19bbedd75e4804b9258c862238993fa160cf9d215ed8", "executableSha256": "e15cbed0f96e36448ed55806bcdb6491fd1883a6d287d56813b087b463fa6ca6" },
          "linux-arm64": { "name": "treehouse-v3.1.3-linux-arm64.tar.gz", "sha256": "9e34a13fd30fa3855520bfa4ad355d3acde139db41fba29e78bdd331633dd617", "executableSha256": "32d2341c9e7e53c775897a6edf5764a9f6ceef9e33edecb5864e1fd5050ffd94" },
          "win32-x64": { "name": "treehouse-v3.1.3-windows-amd64.zip", "sha256": "ac215dad8e8a48e6511b3f55d45e75a76cf67e2a98d22b4500999983da686dde", "executableSha256": "858249dc046bc8678541850539714a0588ba7d2ea6ab4e9678340b5a7741c237" },
          "win32-arm64": { "name": "treehouse-v3.1.3-windows-arm64.zip", "sha256": "19da607c51f90af71a7686737bb91e7ceebb429ef5f70c037d6cdabecf5481d9", "executableSha256": "efd0a52be20786640379525f9ffdcd987d12903c23ca82316561a04df368b3b8" }
        }
      }
    },
    {
      "id": "gnhf",
      "repository": "https://github.com/kunchenguid/gnhf.git",
      "commit": "f2ad5baff8de453bd4222e3d6ce53b43522b1fa2",
      "version": "0.1.51",
      "install": {
        "lane": "npm",
        "package": "gnhf",
        "integrity": "sha512-J5lF9Q3EleLY2qVWOLZKPNDAwg9MNw+OwzPy0qx99OHTDZ/lRglOU7f/IdRkpnur480hqgkq+wPzF4X89Vf6Pg==",
        "lockfile": "locks/npm/gnhf/package-lock.json",
        "lockSha256": "320ad9fcac9cb92f374b6471684f87c04a1b0b47e58e77cf2215c4509577b507"
      }
    },
    {
      "id": "no-mistakes",
      "repository": "https://github.com/kunchenguid/no-mistakes.git",
      "commit": "93b4407137efde476e6588fca809884afa543b9c",
      "version": "1.96.0",
      "install": {
        "lane": "github-release",
        "tag": "v1.96.0",
        "binary": "no-mistakes",
        "artifacts": {
          "darwin-x64": { "name": "no-mistakes-v1.96.0-darwin-amd64.tar.gz", "sha256": "0bb459d37dd06a71e9c45dc816f761717268ed5b579226d028fae31561351e8c", "executableSha256": "5ce2361deab78a0940710b78e62efea56e76769ea6c7200e1cca62748e9403ed" },
          "darwin-arm64": { "name": "no-mistakes-v1.96.0-darwin-arm64.tar.gz", "sha256": "40850ef9cd670fcd8c770d8320084c9f1829035e153029227db32d0bc5b2e9ac", "executableSha256": "5f6e72d98632a0744b8d78cecd6236bfb785b0eb87b9205dd506c9131eea2a2d" },
          "linux-x64": { "name": "no-mistakes-v1.96.0-linux-amd64.tar.gz", "sha256": "5f77e0100f381325d5e0be06be617aa47554b4f50d550438ad034db81e78f0ee", "executableSha256": "54ed819c87954515373e1040d9ecdb1e9f7463315c63c8f554b034f79f0f4021" },
          "linux-arm64": { "name": "no-mistakes-v1.96.0-linux-arm64.tar.gz", "sha256": "20aaaafdd7af5d5d84bfbab0e32b3d729ef0f98131855c38abb2c97d3fca4997", "executableSha256": "74b73a978eecedfefd2c9f2a4566c92402234de2fca8825a657bad5ada35b96a" },
          "win32-x64": { "name": "no-mistakes-v1.96.0-windows-amd64.zip", "sha256": "39d541a938d5bc412fb320ea8d4745aa7732300bf489a65b1950451474f89a64", "executableSha256": "f524680f3a749dff56a1c155da6daf3c934887e33f3416d1ef473b828dcbc307" },
          "win32-arm64": { "name": "no-mistakes-v1.96.0-windows-arm64.zip", "sha256": "389d744e41793f934cec8972ec9fbe54100fe9086506da2a55b505e757faa8ec", "executableSha256": "4584d90766cf3c836aab2ef2b9f189d6a0197a2d23039cb31747ead8c41fe28d" }
        }
      }
    },
    {
      "id": "lavish",
      "repository": "https://github.com/kunchenguid/lavish-axi.git",
      "commit": "7cc7a4d91f0ac160a6ab42db90f2120c977afd01",
      "version": "0.1.87",
      "install": {
        "lane": "npm",
        "package": "lavish-axi",
        "integrity": "sha512-y3xEGLgcWsYah6P7SfHfeoeQyZvHwV0SrMKz19SzhOddaCol7g8khnATWMRUhHgFU9DqInYUirSOV+2Av/dk3w==",
        "lockfile": "locks/npm/lavish/package-lock.json",
        "lockSha256": "0ae4823e80958e0ddb1bbeff77df0b850ec5f4bd1df76a5d99d34f8824e43684"
      }
    },
    {
      "id": "axi",
      "repository": "https://github.com/kunchenguid/axi.git",
      "commit": "5a422752e6c4ce7d1af18bf56d36382374555d7d",
      "version": "0.1.13",
      "install": { "lane": "skill", "skill": "axi" }
    },
    {
      "id": "skills-cli",
      "repository": "https://github.com/vercel-labs/skills.git",
      "commit": "13e4063a1cf913f5606d57d42ab83a86f5001e04",
      "version": "1.7.2",
      "install": {
        "lane": "npm",
        "package": "skills",
        "integrity": "sha512-j+GzyF/oNahsjjjup6y3lJpFkC1lQjIkf4kAMXICA1hboBqi0fAGXAGoE4x9FRZiP1br/YE9+L3/Tqq6PIAe0A==",
        "lockfile": "locks/npm/skills-cli/package-lock.json",
        "lockSha256": "d5e2d0207049c73737563d8ffe6591cb792bb9322aa52a1780068a4d1bb2708e"
      }
    },
    {
      "id": "rea-stable",
      "repository": "https://github.com/morluto/rea.git",
      "commit": "a56f7bb668ab23fec8d33f7af353ac7ed2fe1895",
      "version": "6.4.0",
      "install": {
        "lane": "npm",
        "package": "rea-agents",
        "integrity": "sha512-Vj1zWfSlna5bphGoaoI/TcVBuYvze9u+OyPC3Shz8YkBqaCTqB4COnnRoX7XDwMpwI24ZlFEel2yEj0k8LTWEQ==",
        "lockfile": "locks/npm/rea-stable/package-lock.json",
        "lockSha256": "f8826adbde820ea28ec96e7cb372792296a0092f77ff79f76dda8e4d77967986"
      }
    },
    {
      "id": "rea-edge",
      "repository": "https://github.com/morluto/rea.git",
      "commit": "64041e3072e968002e2085445217ccde1f36e5d7",
      "version": "6.4.0+source.64041e30",
      "install": { "lane": "source", "reason": "Wireshark, Frida, sigrok, Go, Rust, WASM, and SQLite providers are newer than npm 6.4.0." }
    }
  ]
}
